{
  "$schema": "https://json-schema.org/draft/2020-12/schema",
  "$id": "https://example.invalid/human-model/interp-001d2a0-exec0/contract.schema.json",
  "title": "INTERP-001D2a0-EXEC0 contract document envelope",
  "type": "object",
  "additionalProperties": false,
  "required": [
    "$schema",
    "document_kind",
    "schema_version",
    "contract_id",
    "status",
    "predecessor_manifest_sha256",
    "payload"
  ],
  "properties": {
    "$schema": { "const": "./contract.schema.json" },
    "document_kind": {
      "enum": [
        "operator_catalog",
        "operator_golden_vectors",
        "fixture_extension",
        "execution_unit_manifest",
        "lifecycle_processor",
        "evaluator_policy",
        "evaluation_manifest",
        "frozen_artifact_manifest"
      ]
    },
    "schema_version": { "const": "1.0.0" },
    "contract_id": { "const": "INTERP-001D2A0-EXEC0-V0" },
    "status": { "const": "FROZEN_UNEXECUTED" },
    "predecessor_manifest_sha256": {
      "const": "8ee62993fbf302d8037f8cf898a0edca4fe7bbff7b01f73f6a71e8b6c04c3efd"
    },
    "payload": {
      "type": "object",
      "minProperties": 1
    }
  }
}
