{
  "$schema": "./contract.schema.json",
  "document_kind": "fixture_extension",
  "schema_version": "1.0.0",
  "contract_id": "INTERP-001D2A0-EXEC0-V0",
  "status": "FROZEN_UNEXECUTED",
  "predecessor_manifest_sha256": "8ee62993fbf302d8037f8cf898a0edca4fe7bbff7b01f73f6a71e8b6c04c3efd",
  "payload": {
    "evaluation_content_policy": "EXPECTED_RELATIONS_FORBIDDEN",
    "fixtures": [
      {
        "fixture_id": "FX-TRANSIENT-GATE",
        "purpose": "Distinguish T1 access-local masking from T0 current-input behavior and verify no carry at the later access.",
        "access_lineage": [
          { "access_id": "ACCESS-K", "runtime_id": "RUNTIME-G", "target_scope_id": "TARGET-G", "interpretation_scope_id": "INTERP-G", "access_ordinal": 1 },
          { "access_id": "ACCESS-K-PLUS-1", "runtime_id": "RUNTIME-G", "target_scope_id": "TARGET-G", "interpretation_scope_id": "INTERP-G", "access_ordinal": 2 }
        ],
        "clamps": {
          "supplied_path": "PATH-ADVERSE",
          "later_gate_mode": "OPEN",
          "action_feedback": "CLAMPED_ABSENT",
          "self_observation_feedback": "CLAMPED_ABSENT"
        },
        "arms": [
          { "arm_id": "GATE-OPEN", "assignments": { "gate_mode": "OPEN" } },
          { "arm_id": "GATE-MASKED", "assignments": { "gate_mode": "MASKED" } }
        ]
      },
      {
        "fixture_id": "FX-BOUNDED-ACCUMULATION",
        "purpose": "Exercise T2 below and at its declared accumulation limit while keeping T3 revision semantics separately visible.",
        "access_lineage": [
          { "access_id": "ACCESS-K", "runtime_id": "RUNTIME-H", "target_scope_id": "TARGET-H", "interpretation_scope_id": "INTERP-H", "access_ordinal": 1 },
          { "access_id": "ACCESS-K-PLUS-1", "runtime_id": "RUNTIME-H", "target_scope_id": "TARGET-H", "interpretation_scope_id": "INTERP-H", "access_ordinal": 2 },
          { "access_id": "ACCESS-K-PLUS-2", "runtime_id": "RUNTIME-H", "target_scope_id": "TARGET-H", "interpretation_scope_id": "INTERP-H", "access_ordinal": 3 }
        ],
        "clamps": {
          "supplied_path": "PATH-ADVERSE",
          "profile_id": "HET-A",
          "accumulation_limit": 2
        },
        "arms": [
          { "arm_id": "BELOW-LIMIT", "assignments": { "prior_adverse_count": 0, "source_access_ordinal": 1 } },
          { "arm_id": "AT-LIMIT", "assignments": { "prior_adverse_count": 1, "source_access_ordinal": 2 } }
        ]
      },
      {
        "fixture_id": "FX-DECLARED-PROFILE-DISSOCIATION",
        "purpose": "Bind the same ambiguous input to H0 and exact H1 profiles without sampling or persona inference.",
        "access_lineage": [
          { "access_id": "ACCESS-K", "runtime_id": "RUNTIME-I", "target_scope_id": "TARGET-I", "interpretation_scope_id": "INTERP-I", "access_ordinal": 1 }
        ],
        "clamps": {
          "supplied_path": "PATH-AMBIGUOUS",
          "gate_mode": "OPEN",
          "declared_surface_role": "PRIVATE"
        },
        "arms": [
          { "arm_id": "SHARED-INPUT", "assignments": { "input_identity": "PROFILE-DISSOCIATION-INPUT" } }
        ]
      }
    ]
  }
}
