{
  "$schema": "./contract.schema.json",
  "document_kind": "evaluator_policy",
  "schema_version": "1.0.0",
  "contract_id": "INTERP-001D2A0-EXEC0-V0",
  "status": "FROZEN_UNEXECUTED",
  "predecessor_manifest_sha256": "8ee62993fbf302d8037f8cf898a0edca4fe7bbff7b01f73f6a71e8b6c04c3efd",
  "payload": {
    "evaluator_role": "SEPARATE_POST_RUN_EVALUATOR",
    "independence_claim": "PROCESS_ISOLATED_AND_AUTHORITY_SEPARATED_NOT_INDEPENDENT_VERIFICATION",
    "assertion_evaluation_statuses": ["SATISFIED", "VIOLATED", "NOT_APPLICABLE", "NOT_EVALUABLE"],
    "interpretation_codes": [
      "NONE",
      "AUTHORITY_FAILURE",
      "HARD_INVARIANT_FAILURE",
      "STAGE_EXERCISED_AND_TRACE_CHANGED",
      "STAGE_EXERCISED_NO_REGISTERED_EFFECT",
      "NOT_EXERCISED",
      "OPERATIONALLY_ALIASED_UNDER_SCOPE",
      "NOT_IDENTIFIABLE_UNDER_FIXTURE_SET",
      "NON_FALSIFIABLE_ESCAPE_USED"
    ],
    "run_evaluation_statuses": ["CONFORMS_WITHIN_REGISTERED_SCOPE", "DOES_NOT_CONFORM", "PARTIALLY_EVALUABLE"],
    "selector_contract": {
      "required_fields": ["execution_unit_id", "source_kind", "json_pointer", "cardinality"],
      "record_source_additional_fields": ["type_id", "access_ordinal"],
      "cardinality_values": ["EXACTLY_ONE"],
      "zero_match": "NOT_EVALUABLE",
      "multiple_match": "NOT_EVALUABLE",
      "selection_order": "NO_IMPLICIT_FIRST_OR_LAST_SELECTION"
    },
    "predicates": [
      { "predicate_id": "SCALAR_RELATION", "minimum_arity": 2, "maximum_arity": 2, "operand_kind": "STRING_SCALAR", "relations": ["EQUAL", "NOT_EQUAL"] },
      { "predicate_id": "DIGEST_RELATION", "minimum_arity": 2, "maximum_arity": 2, "operand_kind": "SHA256_SCALAR", "relations": ["EQUAL", "NOT_EQUAL"] },
      { "predicate_id": "TRACE_STATUS", "minimum_arity": 1, "maximum_arity": 16, "operand_kind": "TRACE_STATUS_SCALAR", "relations": ["ALL_COMPLETED", "ALL_REJECTED"] },
      { "predicate_id": "ALL_VALUES_DISTINCT", "minimum_arity": 2, "maximum_arity": 16, "operand_kind": "SCALAR", "relations": ["ALL_DISTINCT"] },
      { "predicate_id": "ORDINAL_RELATION", "minimum_arity": 2, "maximum_arity": 2, "operand_kind": "NONNEGATIVE_INTEGER", "relations": ["GREATER_THAN"] }
    ],
    "result_binding": ["execution_manifest_sha256", "execution_unit_manifest_sha256", "run_artifact_sha256", "evaluation_manifest_sha256", "evaluator_policy_sha256"]
  }
}
