{
  "$schema": "./contract.schema.json",
  "document_kind": "operator_golden_vectors",
  "schema_version": "1.0.0",
  "contract_id": "INTERP-001D2A0-EXEC0-V0",
  "status": "FROZEN_UNEXECUTED",
  "predecessor_manifest_sha256": "8ee62993fbf302d8037f8cf898a0edca4fe7bbff7b01f73f6a71e8b6c04c3efd",
  "payload": {
    "visibility": "CONTRACT_TEST_ONLY_NOT_RUNNER_INPUT",
    "vectors": [
      { "vector_id": "GV-H-A", "operator_id": "D2A-H-BIND", "input": { "profile_id": "HET-A" }, "expected": { "reception_bias": "NEUTRAL", "ambiguity_policy": "PRESERVE", "accumulation_limit": 2 } },
      { "vector_id": "GV-H-B", "operator_id": "D2A-H-BIND", "input": { "profile_id": "HET-B" }, "expected": { "reception_bias": "POSITIVE", "ambiguity_policy": "PRESERVE", "accumulation_limit": 2 } },
      { "vector_id": "GV-H-C", "operator_id": "D2A-H-BIND", "input": { "profile_id": "HET-C" }, "expected": { "reception_bias": "NEGATIVE", "ambiguity_policy": "NARROW", "accumulation_limit": 1 } },
      { "vector_id": "GV-R-POS", "operator_id": "D2A-RECEPTION-BIAS", "input": { "supplied_path": "PATH-AMBIGUOUS", "reception_bias": "POSITIVE" }, "expected": { "reception_path": "PATH-BENIGN" } },
      { "vector_id": "GV-R-NEU", "operator_id": "D2A-RECEPTION-BIAS", "input": { "supplied_path": "PATH-AMBIGUOUS", "reception_bias": "NEUTRAL" }, "expected": { "reception_path": "PATH-AMBIGUOUS" } },
      { "vector_id": "GV-R-NEG", "operator_id": "D2A-RECEPTION-BIAS", "input": { "supplied_path": "PATH-AMBIGUOUS", "reception_bias": "NEGATIVE" }, "expected": { "reception_path": "PATH-ADVERSE" } },
      { "vector_id": "GV-T0", "operator_id": "D2A-T0-CURRENT", "input": { "reception_path": "PATH-ADVERSE" }, "expected": { "adjudicated_path": "PATH-ADVERSE", "revision_decision": "NOT_APPLICABLE_TO_MODEL" } },
      { "vector_id": "GV-T1-OPEN", "operator_id": "D2A-T1-GATE", "input": { "reception_path": "PATH-ADVERSE", "gate_mode": "OPEN" }, "expected": { "adjudicated_path": "PATH-ADVERSE", "revision_decision": "NOT_APPLICABLE_TO_MODEL" } },
      { "vector_id": "GV-T1-MASK", "operator_id": "D2A-T1-GATE", "input": { "reception_path": "PATH-ADVERSE", "gate_mode": "MASKED" }, "expected": { "adjudicated_path": "PATH-AMBIGUOUS", "revision_decision": "NOT_APPLICABLE_TO_MODEL" } },
      { "vector_id": "GV-T2-BELOW", "operator_id": "D2A-T2-ACCUMULATE", "input": { "reception_path": "PATH-ADVERSE", "prior_adverse_count": 0, "accumulation_limit": 2, "source_access_ordinal": 1 }, "expected": { "adjudicated_path": "PATH-ADVERSE", "next_adverse_count": 1, "revision_decision": "NOT_ELIGIBLE" } },
      { "vector_id": "GV-T2-LIMIT", "operator_id": "D2A-T2-ACCUMULATE", "input": { "reception_path": "PATH-ADVERSE", "prior_adverse_count": 1, "accumulation_limit": 2, "source_access_ordinal": 2 }, "expected": { "adjudicated_path": "PATH-ADVERSE", "next_adverse_count": 2, "revision_decision": "ELIGIBLE_FROM_FUTURE_ACCESS", "revision_path": "PATH-ADVERSE", "effective_from_ordinal": 3 } },
      { "vector_id": "GV-T2-RESET", "operator_id": "D2A-T2-ACCUMULATE", "input": { "reception_path": "PATH-BENIGN", "prior_adverse_count": 1, "accumulation_limit": 2, "source_access_ordinal": 2 }, "expected": { "adjudicated_path": "PATH-BENIGN", "next_adverse_count": 0, "revision_decision": "NOT_ELIGIBLE" } },
      { "vector_id": "GV-T3-NO-PRIOR", "operator_id": "D2A-T3-REVISE", "input": { "reception_path": "PATH-BENIGN", "applied_revision": "MISSING", "source_access_ordinal": 1 }, "expected": { "adjudicated_path": "PATH-BENIGN", "revision_decision": "ELIGIBLE_FROM_FUTURE_ACCESS", "revision_path": "PATH-BENIGN", "effective_from_ordinal": 2 } },
      { "vector_id": "GV-T3-PRIOR", "operator_id": "D2A-T3-REVISE", "input": { "reception_path": "PATH-BENIGN", "applied_revision": "PATH-ADVERSE", "source_access_ordinal": 2 }, "expected": { "adjudicated_path": "PATH-ADVERSE", "revision_decision": "ELIGIBLE_FROM_FUTURE_ACCESS", "revision_path": "PATH-ADVERSE", "effective_from_ordinal": 3 } },
      { "vector_id": "GV-P0-B", "operator_id": "D2A-P0-DIRECT", "input": { "adjudicated_path": "PATH-BENIGN" }, "expected": { "surface_code": "SURFACE-OPEN" } },
      { "vector_id": "GV-P0-A", "operator_id": "D2A-P0-DIRECT", "input": { "adjudicated_path": "PATH-AMBIGUOUS" }, "expected": { "surface_code": "SURFACE-NEUTRAL" } },
      { "vector_id": "GV-P0-D", "operator_id": "D2A-P0-DIRECT", "input": { "adjudicated_path": "PATH-ADVERSE" }, "expected": { "surface_code": "SURFACE-GUARDED" } },
      { "vector_id": "GV-P1-PRIVATE", "operator_id": "D2A-P1-ROLE", "input": { "adjudicated_path": "PATH-ADVERSE", "declared_surface_role": "PRIVATE" }, "expected": { "surface_code": "SURFACE-GUARDED" } },
      { "vector_id": "GV-P1-PUBLIC-A", "operator_id": "D2A-P1-ROLE", "input": { "adjudicated_path": "PATH-ADVERSE", "declared_surface_role": "PUBLIC" }, "expected": { "surface_code": "SURFACE-NEUTRAL" } },
      { "vector_id": "GV-P1-PUBLIC-B", "operator_id": "D2A-P1-ROLE", "input": { "adjudicated_path": "PATH-BENIGN", "declared_surface_role": "PUBLIC" }, "expected": { "surface_code": "SURFACE-NEUTRAL" } }
    ]
  }
}
